listing_id,id,date,reviewer_id,reviewer_name,comments;;;
"9531,1141449084966348320,2024-04-23,252224832,Casey,""My husband and I stayed here for three nights. Cassie was extremely friendly and communicative. The place was clean, charming, and beautifully decorated. It had so much character and felt so comfortable like visiting a friend. The bed in the primary bedroom was big and the bedding was cozy. We slept better than we do at home!<br/>The neighborhood was peaceful and beautifully landscaped. We didn't want to stay downtown because of how busy it is and this location was perfect. Every Uber arrived within 5 minutes and only took 20 or less to get downtown. <br/>This home exceeded our expectations in every way. We will definitely keep this listing in mind for the future.""";;;
9531,1155961321531750993,2024-05-13,505101770,Jaime,We loved our stay in Cassie’s beautiful home with a fabulous view from the kitchen and deck! The beds were very comfortable and the house felt very welcoming. Would stay there again!;;;
"9531,1161047647786251464,2024-05-20,2898569,Graham,""Home away from home. Super clean and felt wonderful to settle in and relax. Tea and books in the morning on the front porch was lovely.<br/>Easy walk to West Seattle Junction with shop, grocery stores, and restaurants. Not too hard to get downtown Seattle (we drive and parked).""";;;
9531,1169010826271697629,2024-05-31,80243319,Lisa,We thoroughly enjoyed the beautiful Sweet Orange!  Very clean and well appointed.  Beautiful views and amazing yard!  We felt right at home upon arrival.  Cassie is a great host and has a wonderful location.  We hope to revisit in the future! : );;;
9531,1173302265864303878,2024-06-06,77373728,Kate,Words just cannot begin to express how perfect this home was.  Cassie has a knack for colors and design that's incredible.  It's warm and comfortable and she's thought of everything.  There are wonderful niches for sitting and contemplating and others for gathering and others for enjoying the lovely view.  Cassie herself was wonderful.  Responsive and friendly.  We've stayed in lot of AirBNB's in our day and this is absolutely the best.  Just wish Seattle wasn't a hike across country so we could visit regularly!;;;
9531,1174047799655125227,2024-06-07,235119892,Sarah,Great location <br/>Cute spot;;;
"9531,1180649705361819497,2024-06-16,121257704,Nancy,""This was our second stay at Cassie's. The location is perfect for enjoying the Junction and for getting to downtown Seattle quickly. The house has comfortable indoor and outdoor living areas, and is  in a nice neighborhood. Cassie an excellent host, and we plan to return a third time!""";;;
9534,862700,2012-01-15,1323033,Amy,We had a great stay at the Tangerine Dream.  It is a great place to stay in West Seattle - close to everything.  The house is comfortable and spacious even though it is a bottom floor unit.  The utensils and pots/pans for use are better than most of the timeshares we have stayed at.  Cassie makes sure that you have everything you need and you definitely feel welcome.;;;
"9534,2465712,2012-10-01,1933371,Carrie,""Cassie has been an amazing host.  We appreciated her dog-friendliness, as well as her flexibility.  We have stayed in the Tangerine Dream for a month and it is a quiet, cozy place for either a short or longer visit.  The deck and yard are lovely.  The place was spotless when we entered and everything you could need is there.  It is also very convenient to have laundry just off your suite.  Cassie has been very responsive when any question has come up and has gone out of her way to make us feel welcomed to Seattle.  We lucked out to find this place!""";;;
"9534,2680793,2012-10-22,3077193,Kerry,""This beautiful, well-kept house is a great launching pad to explore West Seattle and its unparalleled views of the mountains and the Sound. It is just steps away from Bakery Nouveau, which was voted by Sunset Magazine as the best bakery in Seattle.";;;
<br/>;;;
"<br/>The proprietor leaves many comforts for her guests, like fresh oranges, chocolate, croissants and jam, and organic coffee beans with a grinder, French press and percolator. There is a Trader Joe's and a QFC close by if you want to cook. The beds are luxurious. Also, the house is all on one level, so you don't have to drag heavy luggage up flights of stairs. Overall, an exceptional experience.""";;;
"9534,3217921,2013-01-02,119291,June,""Tangerine Dream is a very cozy, comfortable and located in a very convenient location.  It situates in a quiet neighborhood street but yet only 5 mins walk to restaurants and grocery stores.  Cassie is a lovely host, and very responsive. The house was in a perfect condition when we checked in and the bed is very comfortable.  Cassie even prepared some bagels, coffee, jam etc for us to get start with the next morning!  I would recommend this place to anyone.""";;;
9534,4210518,2013-04-19,3710016,Jane,The Tangerine Dream truly exceeded my expectations.  There is not one thing that I would change.  The kitchen is fully stocked with all the utensils you need.   The beds are so comfortable and the place is immaculate.  The garden is beautiful and peaceful.  Cassie was an amazing hostess and leaves a little treat for all of her guests.  She makes herself available during your stay with any questions including hot spots to visit.  I know I will return to the Tangerine Dream next time I am in West Seattle.;;;
"9534,4530319,2013-05-11,5403909,Hugo,""I had the pleasure to spend 10 days at the Tangerine Dream during a family visit with my elderly mother, and could not have wished for anything else. The Tangerine Dream radiates the warm welcome Cassie emitted when I first contacted her and when we arrived. The appartment is very well equipped, and has proven itself to be extremely comfortable. We immediately felt at home.""";;;
"9534,35131630,2015-06-15,34222990,Leo,""Too bad that our schedule allowed only a two day stay at the Tangerine Dream. Given more time we would have liked to stay much longer at this wonderful place with a great hostess. The apartment is nice and cozy with two comfortable beds in separate rooms, a nice kitchen and a spacious bathroom. The location is close to downtown Seattle with lots of small shops in the neighborhood and lots of activity and decent restaurants at nearby Alki Point. We also appreciated the relatively short distance to SeaTac airport. Even on a busy Monday morning it took well under half an hour to get there. For a visit to Seattle this place is hard to beat.""";;;
"9534,36196896,2015-06-26,28784116,Sara,""The Tangerine Dream was even more wonderful in person than in the pictures, largely to the warm welcome we received from Cassie. This is the type of home I dream to own some day.  My mom, aunt, and sister came into town and stayed here, because my apartment is really small and this house is in my neighborhood. Cassie thought of all the little comforts of home-good coffee, quality spices, fluffy towels, a West Seattle 'favorites' book, etc. And the backyard garden oasis is beyond relaxing. They're already asking when they can come back to visit (and stay here). A fantastic""";;;
9534,40174425,2015-07-28,33941841,Ryan,Cassie is amazing. Great communicator and an awesome place to stay in West Seattle. Close to downtown as well as Alki Beach and walkable to bars on California Ave. The space was just as pictured and Cassie communicated all info pertinent to your stay. Fast internet too. Very impressed!;;;
"9534,40451663,2015-07-31,34841781,Gina,""Cassie is the greatest.  She was in contact with us as we made our way to her beautiful home and met us when we arrived.  She is upbeat, comical, friendly, and a wealth of information about the area.  She has assembled a helpful guide to all the best area restaurants, many that are in walking distance of her home.  It was our first time to the Seattle, and she spent lots of time reviewing  local maps with us and making recommendations.  Her home is absolutely amazing--the pictures don't do it justice!  Everything is just perfect and impeccably decorated with a funky flair. The outdoor space is also fantastic- private and peaceful. She provided us with half-n-half in the fridge, spices, cooking spray, tea and coffee, fruit...and a yummy dark chocolate bar from Trader Joe's!  The place was so comfy that we never wanted to leave, and are planning to return next summer.  Fabulous!""";;;
"9534,42193065,2015-08-11,39662054,Elizabeth,""I booked this MIL for my in-laws that were coming in to town at the last minute. Cassie was extremely helpful in being flexible and accommodating on key pickup, arrival time, and allergy concerns. We arrived to fresh oranges and a chocolate bar on the table (a nice treat!). The fridge was stocked with condiments, and there was tea, spices and coffee. The place was extremely clean and Cassie provided us a walk through describing rules (very few, and all reasonable) for our stay. It is a great space and does not feel like a basement! Extremely colorful and the french doors opening up onto the patio provided great air flow throughout the apartment. The neighborhood was great- just a few blocks from the Junction and a free shuttle to get to the water taxi that takes you downtown! My in-laws had a great time and this place helped make their stay in Seattle extra special.""";;;
"9534,44256622,2015-08-24,19190443,Klaus,""Staying at Cassies place, the Tangerine Dream, was a wonderfull start into our vacation. Everthin in the appartment is done with love, you can see that on the small details of the decoration.";;;
<br/>Everthin is there what you need.;;;
<br/>It is easy to get to Seattle with the water taxi.;;;
"<br/>E loved beeing there and can recommend this place to our friends.""";;;
"9534,45120488,2015-08-31,39636766,Steve & Lori,""We had an amazing stay at the Tangerine Dream, it was perfect from start to finish. Cassie is an incredible host! We loved the beautiful house. There is a huge master bedroom with a walk in closet & very comfortable beds. The pretty tiled bathroom is stocked with soaps, shampoo & much more. The tub/shower combo is great! The adorable well designed kitchen is wonderful too. Cassie left us fresh flowers, a delicious fruit basket & a yummy chocolate bar. It is stocked with gourmet spices, teas, etc. with lots of pots, pans & dishes. You really feel at home here if you want to cook or entertain. Great backyard with a deck, table, chairs & grill. Cassie went above & beyond to provide us with bikes to explore the neighborhood & ride to the beach! Thanks for spoiling us on our first Airbnb stay, can't wait to come back!""";;;
"9534,50758574,2015-10-14,17673505,Jenny,""We had a fantastic stay in the Tangerine Dream. Cassie was wonderful to work with and so welcoming! Loved the little touches like fruit, flowers, coffee, and chocolate! We LOVED West Seattle and exploring the rest of the city. We couldn't have asked for a better experience. Wish we could have stayed longer. Thanks, Cassie! We hope to return!""";;;
"9534,61284236,2016-02-02,21266209,Kelly,""My stay at the Tangerine Dream was wonderful. The home was very quaint and well-maintained. It is in a perfect location in West Seattle, near several bars, restaurants, and coffee shops. Cassie was a perfect host - very kind, helpful, and informative. I hope to stay again soon!""";;;
"9534,67007248,2016-03-26,27997672,Gwen,""The Tangerine Dream was the perfect home base for our recent stay in Seattle.   The Junction neighborhood was easy to navigate with plenty of restaurant and coffee shop options and off-the-cut enough that we didn't feel like we were in all the bustle of downtown.   That being said, we did quite a bit of running around during our time there and it was easy and quick to access the highway.   The home was clean, homey, charming, and offered everything we needed.  I was sorry to leave and would eagerly stay here again on our next visit!   Just a note: the bedrooms are separated from the common areas by heavy drapes, it worked out great for our stay and allowed for an open floorplan when we weren't sleeping but worth mentioning depending on who you are traveling with!";;;
<br/>;;;
"<br/>Thank you so much, Cassie!   """;;;
"9534,68362874,2016-04-04,19697699,Michelle,""The Tangerine Dream is an ideal base for enjoying West Seattle! Cassie was easy to work with and communicative and quickly helped us after we accidentally locked ourselves out of the unit! The space was clean, comfortable and unique, with cool art and bright colors. Cassie included sweet touches like fancy coffee and nice chocolate. Great location a few blocks from West Seattle junction. A bonus: Your own parking space, important in busy Seattle. We will be back!""";;;
9534,68942611,2016-04-07,45488144,John,The home was great! Cassie made quick accommodations for us on very short notice. She even gave us local info on where to run. Will stay again...home as described. ;;;
"9534,69269253,2016-04-10,10578069,Sara,""We loved it. Beautiful garden, kids wonderland. Beds super comfortable. """;;;
"9534,72032130,2016-04-30,3773826,Melissa,""We had a lovely stay at the Tangerine Dream! Cassie thought of everything a guest might need and stocked accordingly! The place has such a warm feel to it, and is just a short walk from tons of restaurants, shops, bars and coffee spots one could need. The little patio right outside gets amazing sunlight for hours and hours, and the garden itself if just a super relaxing nook of your own. Highly recommended!""";;;
"9534,73316296,2016-05-08,29458005,Anna,""Cassie is AMAZING! She is so welcoming and communicative. She is the most helpful and genuinely compassionate. The Tangerine Dream really was a dream come true, too! The pictures/description are spot on and the neighborhood is adorably quaint. We were thrilled to spend time in West Seattle and have this place as our weekend home. Clean, super comfortable, unbelievably gorgeous! """;;;
"9534,74301539,2016-05-14,69098253,Amy,""Cassie & the Tangerine Dream were amazing! Everything we could've needed to cook was there. The beds were insanely comfortable. Everything was clean. ";;;
<br/>;;;
<br/>The neighborhood was clean, beautiful, quiet, and within walking distance to some marvelous dining places. ;;;
<br/>;;;
<br/>Cassie went above and beyond when we left something behind after checkout. ;;;
<br/>;;;
"<br/>We will DEFINITELY stay here again. """;;;
"9534,74977845,2016-05-17,150579,Jacquelyn,""Cassie's place is perfect! It's in a great location, walking to so many West Seattle gems. The decor is warm, cozy and stylish, and the outdoor patio and garden space is a dream! Cassie was extremely prompt and friendly in her communication. This was one of my best Air BnB experiences ever - I highly recommend it!""";;;
"9534,75655009,2016-05-22,14297032,Teri,""Cassie is a delight! She was there waiting for us and had a clean, bright space ready for us. She attends to even the smallest of details: coffee and cream for us in case we couldn't make it to the store right away, oranges and chocolates as a welcome, maps and references for the city, as well as plenty of suggestions about what, when and how to see the sights. We were so pleased with our stay. The location is wonderful as well, within walking distance of the Junction, shops and restaurants, and a lovely Sunday Farmer's market. Coming from Wisconsin and being in the lush, warm Seattle spring was wonderful. """;;;
9534,78753854,2016-06-08,12833054,Jennifer,Cassie and the Tangerine Dream are amazing. Such a lovely space in West Seattle.;;;
9534,79657771,2016-06-13,8750514,Julie,This is one of the best Airbnb experiences I've ever had! One of those rare instances where the reality seven better than the pictures. The apartment is so beautiful and perfectly maintained. Fully stocked everything and HUGE master bedroom. Bed is also super comfy. Location is great - just a short 7 minute walk to Alaska Junction. Cassie clearly takes pride in her role as hostess and takes every detail into consideration. Was extremely accommodating and kind. Couldn't recommend enough! ;;;
9534,80539285,2016-06-18,5905955,Teresa,Cassie was a gracious host who thinks of every detail to make your stay enjoyable!  We loved staying at Tangerine Dream with all of Cassie's special decorative touches in the tangerine theme.  I loved the piggy above the refrigerator and the piggy's behind mounted above the sink.  LOL. The beds were very comfortable and the kitchen was fully outfitted to cook and enjoying eating in.  ;;;
"9534,99750132,2016-09-05,10849137,Angel,""Wow! We just had a great time on our Seattle trip and Cassie's tangerine dream made for the perfect place to call home for a few days! It was cozy, comfortable and perfect for my family of three - everyone had plenty of space to spread out! The dream was spotless clean and well-furnished with everything we needed for a great trip. Cassie was there when we arrived and gave us a quick tour and made us feel so welcome! The location was perfect and we were able to walk to many of our favorite places... We bought way too much vinyl at Easy Street Records! Really, the only bad part of our stay was the fact that we had to fly home today! We would definitely love to stay at the Tangerine Dream again! """;;;
"9534,101684964,2016-09-14,84166833,Mark,""Cassie's place was an absolute pleasure to stay at, with everything we could need. An easy walk to the junction, but set in a lovely garden under the main house. Highly recommend and would stay again""";;;
"9534,103658441,2016-09-23,73387883,Carl,""My wife and I had a great time at the Tangerine Dream! Everything we could possibly need was in there. Comfortable beds, great bathroom and kitchen. Fantastic location. Close to the city. Many wonderful restaurants a short 1/2 mile away. Very clean unit. You will hear the people above you, but it was never an issue. Thanks for being a great host Cassie!""";;;
"9534,121043969,2016-12-13,33160123,Katie,""Oh, my sweet citrus - y'all really need to stay here! I just don't know where to begin - the Tangerine Dream was adorable and is even cuter (and roomier) than the pictures show. We were very impressed with the amenities and it is always nice to see small details, like spices, silverware, glasses, extra lotions, shampoos, etc. It really felt like a home away from home for us - it was cozy, warm, and inviting. Also, the neighborhood was excellent! This was our first time in Seattle, but we honestly like we were a part of the community and the neighborhood. We felt very safe and we were able to walk to several restaurants and shops, and we had a wonderful time exploring the area. Cassie was a wonderful host and she was proactive in her communication - before questions even came up, she had already messaged and answered them. She was very accommodating, friendly, and personable, and she was readily available if we had a question. The next time we stay in Seattle - and we are DEFINITELY coming back - we will book the Tangerine Dream! Best vacation EVER!""";;;
9534,127161626,2017-01-16,65328225,Kathy,We really enjoyed our stay at both the sweet orange and the tangerine dream. The properties are as described and Cassie is a very thoughtful and attentive host. Highly recommended.;;;
"9534,318362133,2018-09-03,73762166,M'Lyn,""After camping and summiting mountains in North Cascades, Cassie's place was the perfect oasis for a few nights of comfy, restful sleep while we explored Seattle. Cassie was great at communicating and made sure we had everything we needed. We felt right at home during our stay. I particularly enjoyed making coffee in the french press and enjoying it at the table on the back porch looking at the garden. Fantastic location - in a quiet neighborhood but just a few short blocks away from adorable shops and restaurants. Proximity to Alki Beach was also a plus - we watched the sunset from there. If I ever come back to Seattle, I'll definitely check to see if this place is available for my stay.""";;;
"9534,325117529,2018-09-18,4673377,Jochen,""My stay started Sep. 3nd 2018 and ended Sept. 18th 2018. I enjoyed my first stay in Seattle. The appartment was great and in accordance with the pictures and descriptions. Cassie is a kind and careful host and she gave me a lot of helpful infomation relative to sightseeing and transportatiion.  <br/>The appartment was clean, quiet and well equipped.  The location of the appartment was close to a lot of busses and groceries. Although if you don't use ground transportion, there is a parking lot you can use. <br/>I think this was not the last stay in Seattle.""";;;
"9534,339702586,2018-10-21,156219430,Howard,""We thoroughly enjoyed our stay at Cassie's Sweet Orange craftsman.  Extremely comfortable space.  Spotless. Well-equipped kitchen.  Great craftsman decorating style.  Cozy gas fire.  Outstanding communication with Cassie.  Great info binder for local restaurants, transportation.  Great neighborhood.  Easy street parking.  Definitely will stay here again, and again!""";;;
9534,342890310,2018-10-29,114672570,Jon,Not much else I can say except that this was the best air bnb experience I’ve ever had. Everything from the home itself to Cassie’s warmth and hospitality merits 5+ stars. Best choice I’ve ever made when booking for travel. Can’t thank her enough for a most memorable stay. My family and I hope to return in the future. <br/>Thanks again Cassie!;;;
"9534,431372041,2019-03-31,79719014,Rick,""Great accommodations in an excellent location.  Convenient walk to water taxi shuttle and express buses to downtown.  Walking distance to shops and restaurants.  Comfortable bed and well stocked kitchen.  Great outdoor  space to relax.  My wife, 4 year old & I  have no complaints.    Cassie was genuine, nice and helpful.  Would not hesitate to book again in the near future 🙂.""";;;
9534,433090124,2019-04-05,12537299,Shannon,Cassie’s place is an absolute gem!  From the beautiful decor to the helpful and prompt communications she is such an amazing host. <br/>The amenities and special touches that she leaves (oranges and chocolate!) go above and beyond what most Airbnb’s have to offer. <br/>We felt so welcomed and comfortable in this beautiful space. Definitely a must stay. One of the best if not the best places we have ever stayed!;;;
9534,445109555,2019-04-28,154262942,Megan,Had a wonderful stay in a wonderful home! The home has its own private entrance and it is very quiet. I was seeking some peace and quiet and found exactly that at the house. It is also close to many shops and restaurants which made it that much more perfect.;;;
"9534,460603116,2019-05-29,9867923,Marie,""We had a great stay.  Comfortable beds, nice shower, and our favorite was the outdoor space. We would definitely come back.""";;;
9534,462043474,2019-06-01,28534532,Peter,This is an example of creative use of space to create a 2 bedroom MIL with a fully functional kitchen located super close to the Alaska junction.  I want to really highlight the willingness of Cassie to work with my schedule and get me in the unit even though it required her to go out of her way while she was traveling herself. It really helped me in a bit of bind.;;;
"9534,482670585,2019-07-06,25029399,Diane,""My sister and husband had a wonderful stay at the Tangerine Dream while visiting us in West Seattle.  The place was spotless, warm and charming.  The location is great, and Cassie is super!""";;;
"9534,525331788,2019-09-07,18971648,Laura,""Cassie’s place is the most charming Airbnb I’ve been in a long time. Check in was easy, the apartment is spotless and quiet. It’s in the perfect location. She’s very easy to communicate with and she made our stay very special! Would definitely return! Highly recommended.""";;;
"9534,529338751,2019-09-14,289718871,Diane T,""As someone mentioned before, I would give more stars if I had the option. Everything just perfect. What a beautiful home. All the amenities you could want plus more that I would never have expected.  Cassie is the ultimate host. We were in town to find an apartment and staying in the area really helped. The neighborhood is wonderful.  Cassie's home really is the Tangerine Dream. It looks just like the pictures and even better. One nice afternoon, I walked to Trader Joe's and another evening we enjoyed a fire while it rained. I regret we didn't have time to walk over to the Farmers' Market.  If you visit, you can expect a beautifully hand-crafted designed home with lots of privacy including the great outdoor  area too.  Cassie's artistic tilework throughout is unbelievable. It was hard to leave such a lovely home and we can't wait to return. And yes, our family member moved into an apartment down a few blocks. Thank you Cassie for such a great stay!""";;;
"9534,552462848,2019-10-21,194760887,Betsy,""Beautiful Craftsman home nestled in West Seattle within walking distance to The Junction. Beds were super cozy and comfortable, bathroom big and fabulous, writing desk, kitchen with everything you need, and a great dining room.  Everything was sparkling clean. Check-in was super easy and our host was very kind, professional and responsive. We loved our stay here!""";;;
"9534,556113053,2019-10-28,164993652,Nave,""Beautiful place to stay highly recommended for people that want to feel the city, and to stay in a real Airbnb apartment. <br/>Clean/green/good vibes 🤙""";;;
"9534,570488981,2019-11-29,76554762,Ginny,""An artistic oasis, the colors are joyful, the towels are soft and there's a variety of cozy places to read. Also, only one block from the French Bakery, so it's an ideal location.""";;;
"9534,574845181,2019-12-08,309578436,Rian,""Cute, quaint, and we'll appointed. Owner is responsive and friendly.""";;;
